<?xml version="1.0"?>
<Container version="2" xmlns:xsi="http://www.w3.org/2001/XMLSchema-instance" xsi:schemaLocation="https://raw.githubusercontent.com/nwithan8/unraid_templates/main/templates/template_schema.xsd template_schema.xsd">
    <Name>Superstreamer - Stitcher</Name>
    <Repository>superstreamerapp/stitcher:latest</Repository>
    <Registry>https://hub.docker.com/r/superstreamerapp/stitcher</Registry>
    <Branch>
        <Tag>latest</Tag>
        <TagDescription>Latest stable release</TagDescription>
    </Branch>
    <Network>bridge</Network>
    <Privileged>false</Privileged>
    <Support>https://superstreamer.xyz/guide/getting-started</Support>
    <Project>https://superstreamer.xyz</Project>
    <Overview>
        Superstreamer is here to make video delivery simple. Imagine having everything you need in one platform â€” starting with your raw video, Superstreamer helps you transcode it, package it into HLS playlists, and upload it to S3 with ease. You can even create custom playlists for each viewer, adding bumpers, ads, or filters on the fly.
    </Overview>
    <Category>MediaApp:Music MediaApp:Video MediaServer:Music MediaServer:Video Cloud: Productivity: Tools: Other: Status:Stable</Category>
    <ExtraSearchTerms>music video hosting transcode server streaming download playlists queue Stitcher ads advertisements sponsors</ExtraSearchTerms>
    <Icon>https://raw.githubusercontent.com/nwithan8/unraid_templates/master/images/superstreamer-icon.png</Icon>
    <TemplateURL>https://raw.githubusercontent.com/nwithan8/unraid_templates/main/templates/superstreamer_stitcher.xml</TemplateURL>
    <Maintainer>
        <WebPage>https://github.com/nwithan8</WebPage>
    </Maintainer>
    <Changes>
        ### 2025-03-30

        Update environmental variables

        ### 2024-10-14

        Initial release
    </Changes>
     <Requires>
        This is the Stitcher for the Superstreamer suite. It requires other Superstreamer containers to be running. &#xD;
    </Requires>
    <Config Name="Application Port" Target="52002" Default="52002" Mode="tcp" Description="Port over which other containers will communicate with this container" Type="Port" Display="always-hide" Required="true" Mask="false">52002</Config>
    <Config Name="Redis - URI" Target="REDIS_URI" Default="redis://localhost:6379" Description="URI of the Redis database" Type="Variable" Display="always-hide" Required="true" Mask="false">redis://localhost:6379</Config>
    <Config Name="Public API Endpoint" Target="PUBLIC_API_ENDPOINT" Default="http://localhost:520001" Description="Publicly accessible URL for Superstreamer API container. Replace with your IP or domain." Type="Variable" Display="always-hide" Required="true" Mask="false">http://localhost:52001</Config>
    <Config Name="Secret" Target="SUPER_SECRET" Default="" Description="Secret key for the API" Type="Variable" Display="always-hide" Required="true" Mask="true"/>
    <Config Name="Public Stitcher Endpoint" Target="PUBLIC_STITCHER_ENDPOINT" Default="http://localhost:52002" Description="Publicly accessible URL for Superstreamer Stitcher container. Replace with your IP or domain." Type="Variable" Display="always-hide" Required="true" Mask="false">http://localhost:52002</Config>
    <Config Name="Public AWS S3 Endpoint" Target="PUBLIC_S3_ENDPOINT" Default="" Description="Publicly accessible URL for S3 storage bucket used to store media files." Type="Variable" Display="always-hide" Required="true" Mask="false"/>
    <Config Name="Internal App Port" Target="PORT" Default="52002" Mode="tcp" Description="Internal port for container. Not recommended to change." Type="Port" Display="advanced-hide" Required="true" Mask="false">52002</Config>
</Container>
