<?xml version="1.0"?>
<Container version="2" xmlns:xsi="http://www.w3.org/2001/XMLSchema-instance" xsi:schemaLocation="https://raw.githubusercontent.com/nwithan8/unraid_templates/main/template_schema.xsd template_schema.xsd">
    <Name>TVx</Name>
    <Repository>ghcr.io/dopeytree/tvx:latest</Repository>
    <Registry>ghcr.io/dopeytree/tvx</Registry>
    <Branch>
        <Tag>latest</Tag>
        <TagDescription>Latest stable release</TagDescription>
    </Branch>
    <Network>bridge</Network>
    <WebUI>http://[IP]:[PORT:8777]/</WebUI>
    <Privileged>false</Privileged>
    <Support>https://github.com/dopeytree/TVx/issues</Support>
    <Project>https://github.com/dopeytree/TVx</Project>
    <Overview>
        A vintage TV experience for M3U playlists
    </Overview>
    <Beta>False</Beta>
    <Category>MediaApp:Video Productivity: Tools: Other: Status:Stable</Category>
    <ExtraSearchTerms>m3u xml iptv tv guide crt vintage player plex emby jellyfin tunarr dizquetv ersatz</ExtraSearchTerms>
    <Icon>https://raw.githubusercontent.com/dopeytree/TVx/main/public/logo.png</Icon>
    <TemplateURL>https://raw.githubusercontent.com/nwithan8/unraid_templates/main/templates/tvx.xml</TemplateURL>
    <Screenshot>https://raw.githubusercontent.com/dopeytree/TVx/main/public/screenshot-1.png</Screenshot>
    <Screenshot>https://raw.githubusercontent.com/dopeytree/TVx/main/public/screenshot-2.png</Screenshot>
    <Screenshot>https://raw.githubusercontent.com/dopeytree/TVx/main/public/screenshot-3.png</Screenshot>
    <Screenshot>https://raw.githubusercontent.com/dopeytree/TVx/main/public/screenshot-4.png</Screenshot>
    <Screenshot>https://raw.githubusercontent.com/dopeytree/TVx/main/public/screenshot-5.png</Screenshot>
    <Maintainer>
        <WebPage>https://github.com/nwithan8</WebPage>
    </Maintainer>
    <Changes>
        ### 2025-10-21

        Add missing environment variables

        ### 2025-10-13

        Initial release
    </Changes>
    <Requires>
        Requires an M3U playlist and optional XMLTV (EPG) guide file. Tunarr or Dizquetv paired with Plex, Emby or Jellyfin recommended.
    </Requires>
    <Config Name="Web UI Port" Target="80" Default="8777" Mode="tcp" Description="Container Port: 80" Type="Port" Display="always-hide" Required="true" Mask="false">8777</Config>
    <Config Name="M3U URL" Target="VITE_M3U_URL" Default="http://your-tunarr-ip-address:8000/api/channels.m3u" Description="M3U URL for IPTV stream" Type="Variable" Display="always-hide" Required="true" Mask="false">http://your-tunarr-ip-address:8000/api/channels.m3u</Config>
    <Config Name="XMLTV URL" Target="VITE_XMLTV_URL" Default="http://your-tunarr-ip-address:8000/api/xmltv.xml" Description="EPG URL for IPTV stream" Type="Variable" Display="always-hide" Required="true" Mask="false">http://your-tunarr-ip-address:8000/api/xmltv.xml</Config>
    <Config Name="App Data" Target="/config" Default="/mnt/user/appdata/tvx/config" Mode="rw" Description="Path for persistent storage of settings, configuration files" Type="Path" Display="advanced-hide" Required="true" Mask="false">/mnt/user/appdata/tvx/config</Config>
</Container>
