<?xml version="1.0"?>
<Container version="2" xmlns:xsi="http://www.w3.org/2001/XMLSchema-instance" xsi:schemaLocation="https://raw.githubusercontent.com/nwithan8/unraid_templates/main/templates/template_schema.xsd template_schema.xsd">
    <Name>TodoChat</Name>
    <Repository>ghcr.io/itsluminous/todochat:main</Repository>
    <Registry>ghcr.io/itsluminous/todochat</Registry>
    <Branch>
        <Tag>main</Tag>
        <TagDescription>Latest stable release</TagDescription>
    </Branch>
    <Network>bridge</Network>
    <WebUI>http://[IP]:[PORT:3000]/</WebUI>
    <Privileged>false</Privileged>
    <Support>https://github.com/itsluminous/TodoChat/issues</Support>
    <Project>https://todo-list-seven-teal.vercel.app</Project>
    <Overview>
        Minimal web UI for Gemini Pro Chat, hidden behind a Todo app to avoid censorship.
    </Overview>
    <Beta>False</Beta>
    <Category>AI: Productivity: Tools: Other: Status:Stable</Category>
    <ExtraSearchTerms>gemini chat gpt ai chat google</ExtraSearchTerms>
    <Icon>https://raw.githubusercontent.com/nwithan8/unraid_templates/master/images/todochat-icon.png</Icon>
    <TemplateURL>https://raw.githubusercontent.com/nwithan8/unraid_templates/main/templates/todochat.xml</TemplateURL>
    <Screenshot>https://raw.githubusercontent.com/nwithan8/unraid_templates/master/images/todochat_demo.gif</Screenshot>
    <Maintainer>
        <WebPage>https://github.com/nwithan8</WebPage>
    </Maintainer>
    <Changes>
        ### 2025-04-27

        Fix image registry

        ### 2025-02-07

        Initial release
    </Changes>
    <Config Name="Web UI Port" Target="3000" Default="3000" Mode="tcp" Description="Container Port: 3000" Type="Port" Display="always-hide" Required="true" Mask="false">3000</Config>
    <Config Name="Gemini API Key" Target="GEMINI_API_KEY" Default="" Description="Gemini API Key" Type="Variable" Display="always-hide" Required="true" Mask="true"/>
    <Config Name="Secret Switch" Target="TODO_SECRET" Default="" Description="Secret to-do item to switch to chat mode" Type="Variable" Display="always-hide" Required="true" Mask="true"/>
    <Config Name="API Base URL" Target="API_BASE_URL" Default="" Description="Custom base URL for the Gemini API" Type="Variable" Display="advanced" Required="false" Mask="false"/>
    <Config Name="Head Scripts" Target="HEAD_SCRIPTS" Default="" Description="Custom scripts to include in the head of the page" Type="Variable" Display="advanced" Required="false" Mask="false"/>
    <Config Name="Public Secret Key" Target="PUBLIC_SECRET_KEY" Default="" Description="Public secret key to generate signatures for API calls" Type="Variable" Display="advanced" Required="false" Mask="true"/>
    <Config Name="Site Password" Target="SITE_PASSWORD" Default="" Description="Comma-separated list of passwords to access the site. If not provided, site will be public." Type="Variable" Display="advanced" Required="false" Mask="true"/>
</Container>
